created_at,text
Sat Oct 13 20:48:09 +0000 2018,WELCOME HOME PASTOR ANDREW BRUNSON! https://t.co/HijeAGU1gy
Sat Oct 13 20:42:22 +0000 2018,https://t.co/uIaENHQoPK
Sat Oct 13 17:52:26 +0000 2018,"Heading to the Great State of Kentucky - Big Rally for Congressman Andy Barr - Fantastic guy, need his vote for MAG… https://t.co/lij3Xifvbf"
Sat Oct 13 17:43:02 +0000 2018,Highly respected Congressman Keith Rothfus (R) of Pennsylvania is in the fight of his life because the Dems changed… https://t.co/BBhPq05XoC
Sat Oct 13 17:03:06 +0000 2018,“From a Turkish prison to the White House in 24 hours.”  Kristin Fisher of @FoxNews   Very cool!
Sat Oct 13 14:17:57 +0000 2018,There was NO DEAL made with Turkey for the release and return of Pastor Andrew Brunson. I don’t make deals for host… https://t.co/igiQXPfKSv
Sat Oct 13 14:06:26 +0000 2018,"Pastor Andrew Brunson, released by Turkey, will be with me in the Oval Office at 2:30 P.M. (this afternoon). It wil… https://t.co/j4x6lohKsr"
Sat Oct 13 13:31:27 +0000 2018,Happy 243rd Birthday to our GREAT @USNavy! #243NavyBday https://t.co/m1YtoKSHFw
Sat Oct 13 01:17:01 +0000 2018,"RT @realDonaldTrump: Don’t miss our GREAT @FLOTUS, Melania, on @ABC @ABC2020 tonight at 10pmE. Enjoy!"
Sat Oct 13 00:30:16 +0000 2018,"Beautiful MAKE AMERICA GREAT AGAIN rally in Lebanon, Ohio. Thank you! #ICYMI, watch here: https://t.co/UGQAmARPKR https://t.co/6nsoV8yTx3"
Fri Oct 12 22:14:44 +0000 2018,"The GREAT football (and lacrosse) player, Jim Brown outside the West Wing of the @WhiteHouse. He is also a tremendo… https://t.co/p7FLWOAg68"
Fri Oct 12 22:02:19 +0000 2018,https://t.co/HHTwwbuKa2
Fri Oct 12 21:30:27 +0000 2018,RT @WhiteHouse: https://t.co/IqLBKtgNEf
Fri Oct 12 19:37:27 +0000 2018,Happy #NationalFarmersDay! With the recent #USMCA our GREAT FARMERS will do better than ever before!! https://t.co/PMS4z2EScY
Fri Oct 12 19:10:51 +0000 2018,"Don’t miss our GREAT @FLOTUS, Melania, on @ABC @ABC2020 tonight at 10pmE. Enjoy!"
Fri Oct 12 18:09:17 +0000 2018,People have no idea how hard Hurricane Michael has hit the great state of Georgia. I will be visiting both Florida… https://t.co/YoYRIV22Ji
Fri Oct 12 16:43:13 +0000 2018,"PROMISES MADE, PROMISES KEPT! https://t.co/2lk8Fjspe4"
Fri Oct 12 15:57:52 +0000 2018,REGISTER TO VOTE! https://t.co/0pWiwCHGbh https://t.co/EOCLoJJ24B
Fri Oct 12 14:26:00 +0000 2018,PASTOR BRUNSON JUST RELEASED. WILL BE HOME SOON!
Fri Oct 12 13:59:06 +0000 2018,"My thoughts and prayers are with Pastor Brunson, and we hope to have him safely back home soon!"
Fri Oct 12 13:54:46 +0000 2018,"So nice, everyone wants Ivanka Trump to be the new United Nations Ambassador. She would be incredible, but I can al… https://t.co/Dab4lBqUNq"
Fri Oct 12 13:42:04 +0000 2018,Working very hard on Pastor Brunson!
Thu Oct 11 22:49:26 +0000 2018,"RT @FLGuard: There are serious communication issues in the Panhandle after #HurricaneMichael. If you are worried about someone, visit https…"
Thu Oct 11 22:14:23 +0000 2018,RT @WhiteHouse: President Trump provides an update on the response to Hurricane Michael: https://t.co/zmnHXKakYw
Thu Oct 11 17:23:27 +0000 2018,"RT @WhiteHouse: Moments ago, President Trump signed the Music Modernization Act, which will close loopholes in our digital royalty laws to…"
Thu Oct 11 16:21:53 +0000 2018,https://t.co/xJ9QYGMJXa
Thu Oct 11 14:43:33 +0000 2018,https://t.co/rsxEwbFZht
Thu Oct 11 14:41:01 +0000 2018,https://t.co/h47S6T9u8V
Thu Oct 11 03:44:00 +0000 2018,"Florida Highway Patrol Troopers are all en route to the Panhandle, from all across the state of Florida - to help t… https://t.co/FWP05H9NSv"
Thu Oct 11 01:35:15 +0000 2018,Thank you to @FEMA and all First Responders! #HurricaneMichael https://t.co/vwN8BbrkkJ
Thu Oct 11 01:33:21 +0000 2018,Thank you Jacksonville Sheriff’s Office! #HurricaneMichael https://t.co/fuy7stLMJI
Thu Oct 11 01:00:18 +0000 2018,"Massive overflow crowd tonight in Erie, Pennsylvania. THANK YOU to everyone who came out and joined us. Together, w… https://t.co/bUn2dwuE1X"
Thu Oct 11 00:52:29 +0000 2018,"Thank you Erie, Pennsylvania! Remember to get out and VOTE! #MAGA🇺🇸 https://t.co/X8IEW8h9qP"
Wed Oct 10 22:33:48 +0000 2018,RT @fema: It’s extremely important to keep sheltering in a safe place and to stay aware as #Michael continues to move inland! https://t.co/…
Wed Oct 10 22:33:37 +0000 2018,"RT @USNationalGuard: LIVE UPDATE: @AlabamaNG, @GeorgiaGuard, @FLGuard and @NCNationalGuard vehicles and personnel are staged and ready to p…"
Wed Oct 10 21:05:08 +0000 2018,"RT @WhiteHouse: Earlier today: President @realDonaldTrump, joined by Homeland Security @SecNielsen, listens as @FEMA_Brock briefs reporters…"
Wed Oct 10 21:01:55 +0000 2018,Couldn’t let these great people down. They have been lined up since last night - see you soon Pennsylvania! https://t.co/jSrsmncw85
Wed Oct 10 19:52:23 +0000 2018,"Departing the @WhiteHouse for Erie, Pennsylvania. I cannot disappoint the thousands of people that are there - and… https://t.co/f63EzMSJvE"
Wed Oct 10 17:39:59 +0000 2018,"RT @USATODAY: .@usatodayopinion: Democrats want to outlaw private health care plans, taking away freedom to choose plans while letting anyo…"
Wed Oct 10 16:52:17 +0000 2018,"RT @FLGuard: #HurricaneMichael is here, but so are we. Stay safe, Florida. #FloridaFirst #FLNGAlwaysThere https://t.co/e2rVNXFERp"
Wed Oct 10 16:43:12 +0000 2018,"RT @EricTrump: All my friends in Missouri, today is your LAST CHANCE to register to vote this November! It is very easy to do - simply go t…"
Wed Oct 10 16:05:55 +0000 2018,"We are with you Florida! https://t.co/qzrVLeFbyF
https://t.co/HVVhSmBg7S https://t.co/rcB6OCwLeH"
Wed Oct 10 13:01:05 +0000 2018,"Despite so many positive events and victories, Media Reseach Center reports that 92% of stories on Donald Trump are… https://t.co/YHfGjfMThn"
Wed Oct 10 12:50:56 +0000 2018,"RT @NHC_Surge: A destructive and life-threatening storm surge event will occur along portions of the Florida Panhandle, Big Bend, and Natur…"
Wed Oct 10 12:50:06 +0000 2018,"RT @FAANews: Due to #HurricaneMichael, flights in your area could be delayed and possibly cancelled. Please continue to check the status of…"
Wed Oct 10 12:49:08 +0000 2018,RT @FLSERT: Hurricane shelter locations are accessible from: https://t.co/Hop887IoiC #HurricaneMichael https://t.co/Ljk8boFaSw
Wed Oct 10 12:48:59 +0000 2018,"RT @NHC_Atlantic: Hurricane #Michael.  In addition to the life-threatening storm surge and wind impacts, heavy rainfall is expected across…"
Wed Oct 10 12:48:41 +0000 2018,RT @NHC_Atlantic: Hurricane force winds are expected to extend well inland over portions of the Florida Panhandle and portions of southeast…
Wed Oct 10 12:48:26 +0000 2018,"RT @NHC_Atlantic: A Storm Surge Warning remains in effect for much of the Florida Panhandle and Big Bend region, where life-threatening sto…"
Wed Oct 10 12:48:11 +0000 2018,RT @NHC_Atlantic: NHC Director Ken Graham will provide a Facebook Live broadcast regarding Category 4 Hurricane #Michael at 8:45 a.m. EDT (…
Wed Oct 10 12:47:57 +0000 2018,"RT @fema: As Hurricane #Michael nears land, take shelter &amp; stay safe.

📱Follow weather updates on your phone or radio.

🔹 In a tornado WARN…"
Wed Oct 10 12:47:01 +0000 2018,Walker Stapleton is running as the highly respected Republican Candidate for Governor of the Great State of Colorad… https://t.co/Q0sTaKwDlH
Wed Oct 10 02:28:10 +0000 2018,"RT @FLGovScott: If you’re in an evacuation zone, I am urging you to leave RIGHT NOW. Do not risk your life or the lives of your loved ones-…"
Wed Oct 10 01:23:49 +0000 2018,"THANK YOU IOWA &amp; NEBRASKA! VOTE, VOTE, VOTE! https://t.co/0pWiwCHGbh https://t.co/tzkiQ4IlEd"
Wed Oct 10 01:18:12 +0000 2018,https://t.co/CPf3oxgdRX
Wed Oct 10 01:09:41 +0000 2018,Beautiful evening in Iowa. GOD BLESS THE U.S.A.! #MAGA🇺🇸 https://t.co/Zi0rwyajrz
Tue Oct 09 22:18:13 +0000 2018,RT @fema: Flooding from Hurricane #Michael will affect several states. Finish preparations ASAP and get ready to shelter in a safe location…
Tue Oct 09 21:59:52 +0000 2018,RT @FLOTUS: Thank you Egypt 🇪🇬 🇺🇸 https://t.co/7i0POn29XN
Tue Oct 09 21:59:51 +0000 2018,RT @FLOTUS: Thank you Kenya 🇰🇪 🇺🇸 https://t.co/5FXP7Ki3Zw
Tue Oct 09 21:39:22 +0000 2018,.@FLGovScott has been relentless in securing the funding to fix the algae problem from Lake Okeechobee - we will so… https://t.co/6XMMjQ0V4v
Tue Oct 09 21:34:50 +0000 2018,"RT @Scavino45: Congratulations to our 114th Supreme Court Justice, Brett M. Kavanaugh! #SCOTUS🏛🇺🇸

🔟📸https://t.co/c3YdNNcU7c https://t.co/A…"
Tue Oct 09 19:08:57 +0000 2018,“President Donald J. Trump Approves Florida Emergency Declaration” https://t.co/TnTDCvs41W
Tue Oct 09 16:36:48 +0000 2018,REGISTER TO VOTE! https://t.co/0pWiwCHGbh https://t.co/3vYfDmpqiH
Tue Oct 09 16:07:03 +0000 2018,"FLORIDA - It is imperative that you heed the directions of your State and Local Officials. Please be prepared, be c… https://t.co/wPghUO1OF2"
Tue Oct 09 16:00:05 +0000 2018,"...Looks to be a Cat. 3 which is even more intense than Florence. Good news is, the folks in the Pan Handle can tak… https://t.co/60JuUt9tp9"
Tue Oct 09 16:00:04 +0000 2018,"Hurricane on its way to the Florida Pan Handle with major elements arriving tomorrow. Could also hit, in later stag… https://t.co/xycrRUIBTh"
Tue Oct 09 14:18:47 +0000 2018,Big announcement with my friend Ambassador Nikki Haley in the Oval Office at 10:30am.
Tue Oct 09 13:23:21 +0000 2018,RT @realDonaldTrump: https://t.co/4ySIkmfllE
Tue Oct 09 13:10:01 +0000 2018,"Will be going to Iowa tonight for Rally, and more! The Farmers (and all) are very happy with USMCA!"
Tue Oct 09 12:37:55 +0000 2018,Great evening last night at the White House honoring Justice Kavanaugh and family. Our country is very proud of them!
Tue Oct 09 12:32:46 +0000 2018,"The paid D.C. protesters are now ready to REALLY protest because they haven’t gotten their checks - in other words,… https://t.co/3es06u6W6e"
Tue Oct 09 12:19:53 +0000 2018,"RT @NWSTallahassee: 8am Intermediate Advisory from @NHC_Atlantic upgrades #HurricaneMichael into a category 2 hurricane. Keep in mind, wind…"
Tue Oct 09 12:18:39 +0000 2018,"RT @fema: ⚠️If you're told to evacuate for Hurricane #Michael, don't delay. Leave as soon as possible. 

Listen to @FLSERT and local offici…"
Tue Oct 09 01:34:56 +0000 2018,https://t.co/4ySIkmfllE
Mon Oct 08 23:43:34 +0000 2018,https://t.co/k2bOxapRtR
Mon Oct 08 19:44:49 +0000 2018,Great to see @AGPamBondi launch a cutting-edge statewide school safety APP in Florida today - named by Parkland Sur… https://t.co/4PBXblZ0JW
Mon Oct 08 19:37:36 +0000 2018,"Every day, our police officers race into darkened allies, deserted streets, &amp; onto the doorsteps of the most harden… https://t.co/oaai3FVg0o"
Mon Oct 08 19:27:41 +0000 2018,We thank you. We salute you. We honor you. And we promise you: we will ALWAYS have your BACK – now and FOREVER!… https://t.co/RnvDOTLvu8
Mon Oct 08 18:57:07 +0000 2018,America’s police officers have earned the everlasting gratitude of our Nation. In moments of danger &amp; despair you a… https://t.co/movE69yT0F
Mon Oct 08 18:32:51 +0000 2018,"It was my great honor to address the International Association of Chiefs of Police Annual Convention in Orlando, Fl… https://t.co/FjZmjHo9CT"
Mon Oct 08 15:31:51 +0000 2018,"Departing Washington, D.C. for the International Association of Chiefs of Police Annual Convention in Orlando, Flor… https://t.co/HNDU0DuCnA"
Mon Oct 08 13:36:11 +0000 2018,Christopher Columbus’s spirit of determination &amp; adventure has provided inspiration to generations of Americans. On… https://t.co/tIXXwhxDci
Sun Oct 07 18:15:22 +0000 2018,RT @FLOTUS: Thank you Kenya 🇰🇪 🇺🇸 https://t.co/JrHncob8Qp
Sun Oct 07 14:42:25 +0000 2018,.@SecPompeo had a good meeting with Chairman Kim today in Pyongyang. Progress made on Singapore Summit Agreements!… https://t.co/kzwV5wAVSq
Sun Oct 07 01:21:22 +0000 2018,"You don’t hand matches to an arsonist, and you don’t give power to an angry left-wing mob. Democrats have become to… https://t.co/VB23FlFvOT"
Sun Oct 07 01:15:00 +0000 2018,"Beautiful evening in Topeka, Kansas. VOTE, VOTE, VOTE! #MAGA https://t.co/bomRqsaYfm"
Sun Oct 07 00:49:56 +0000 2018,"Thank you Kansas - I love you! 
https://t.co/ymCFNr9WQY"
Sat Oct 06 21:57:09 +0000 2018,"The crowd in front of the U.S. Supreme Court is tiny, looks like about 200 people (&amp; most are onlookers) - that wou… https://t.co/K0175DLRAK"
Sat Oct 06 20:15:30 +0000 2018,"I applaud and congratulate the U.S. Senate for confirming our GREAT NOMINEE, Judge Brett Kavanaugh, to the United S… https://t.co/573HIDggVn"
Sat Oct 06 20:06:01 +0000 2018,"I have asked Steve Daines, our great Republican Senator from Montana, to attend his daughter Annie’s wedding rather… https://t.co/3cvHEGT5QS"
Sat Oct 06 16:08:57 +0000 2018,"Women for Kavanaugh, and many others who support this very good man, are gathering all over Capitol Hill in prepara… https://t.co/lrE7vMwl8k"
Sat Oct 06 03:46:07 +0000 2018,"RT @realDonaldTrump: Thank you Minnesota - I love you!
https://t.co/eQC2NqdIil"
Fri Oct 05 21:29:54 +0000 2018,RT @FLOTUS: Thank you Malawi! 🇺🇸 🇲🇼 https://t.co/rE03LMNzOZ
Fri Oct 05 21:29:49 +0000 2018,RT @FLOTUS: Thank you Ghana! 🇺🇸 🇬🇭 https://t.co/d34cqFyRdN
Fri Oct 05 14:59:41 +0000 2018,Very proud of the U.S. Senate for voting “YES” to advance the nomination of Judge Brett Kavanaugh!
Fri Oct 05 13:06:08 +0000 2018,Just out: 3.7% Unemployment is the lowest number since 1969!
Fri Oct 05 13:03:06 +0000 2018,The very rude elevator screamers are paid professionals only looking to make Senators look bad. Don’t fall for it!… https://t.co/2In7zzWHoS
Fri Oct 05 11:28:02 +0000 2018,"RT @newsobserver: Presidential adviser and daughter @IvankaTrump will make 3 stops in NC to see hurricane relief efforts, thank first respo…"
Fri Oct 05 11:25:42 +0000 2018,"RT @Scavino45: 🚨Happening Now | 2:08amE; Our great @FLOTUS, Melania Trump...visiting a Kenyan elephant orphanage...https://t.co/rW2cWXaswf"
Fri Oct 05 01:03:25 +0000 2018,"Beautiful evening in Rochester, Minnesota. VOTE, VOTE, VOTE! https://t.co/SyxrxvTpZE"
Fri Oct 05 00:52:20 +0000 2018,"Thank you Minnesota - I love you!
https://t.co/eQC2NqdIil"
Thu Oct 04 22:58:21 +0000 2018,Just made my second stop in Minnesota for a MAKE AMERICA GREAT AGAIN rally. We need to elect @KarinHousley to the U… https://t.co/rOGv3fAwzV
Thu Oct 04 22:17:48 +0000 2018,Congressman Bishop is doing a GREAT job! He helped pass tax reform which lowered taxes for EVERYONE! Nancy Pelosi i… https://t.co/g6kT6INueQ
Thu Oct 04 19:29:27 +0000 2018,“U.S. Stocks Widen Global Lead” https://t.co/Snhv08ulcO
Thu Oct 04 19:17:28 +0000 2018,Statement on National Strategy for Counterterrorism: https://t.co/ajFBg9Elsj https://t.co/Qr56ycjMAV
Thu Oct 04 17:38:08 +0000 2018,"Working hard, thank you! https://t.co/6HQVaEXH0I"
Thu Oct 04 14:17:01 +0000 2018,"This is now the 7th. time the FBI has investigated Judge Kavanaugh. If we made it 100, it would still not be good e… https://t.co/RnF7pKPVyZ"
Thu Oct 04 14:01:13 +0000 2018,"RT @ChatByCC: While armed with the power of our Vote, we proudly &amp; peacefully revolted

Never doubt this was an American revolution

#MAGA…"
Thu Oct 04 13:54:58 +0000 2018,"This is a very important time in our country. Due Process, Fairness and Common Sense are now on trial!"
Thu Oct 04 13:34:16 +0000 2018,"Our country’s great First Lady, Melania, is doing really well in Africa. The people love her, and she loves them! I… https://t.co/YkcuOHtrDW"
Thu Oct 04 12:16:41 +0000 2018,The harsh and unfair treatment of Judge Brett Kavanaugh is having an incredible upward impact on voters. The PEOPLE… https://t.co/tz7uynzT5p
Thu Oct 04 02:23:11 +0000 2018,"Wow, such enthusiasm and energy for Judge Brett Kavanaugh. Look at the Energy, look at the Polls. Something very bi… https://t.co/62VvhKHKXu"
Thu Oct 04 00:01:09 +0000 2018,"My thoughts and prayers are with the Florence County Sheriff’s Office and the Florence Police Department tonight, i… https://t.co/CX6358MmOs"
Wed Oct 03 14:35:48 +0000 2018,"Just spoke to President-Elect Andres Manuel Lopez Obrador of Mexico. Great call, we will work well together!"
Wed Oct 03 14:29:25 +0000 2018,I see it each time I go out to Rallies in order to help some of our great Republican candidates. VOTERS ARE REALLY… https://t.co/chRkQ8hVvt
Wed Oct 03 14:13:42 +0000 2018,"Mexico, Canada and the United States are a great partnership and will be a very formidable trading force. We will n… https://t.co/7dnrquzER9"
Wed Oct 03 14:05:28 +0000 2018,"Blowout numbers on New Jobs and, separately, Services. Market up!"
Wed Oct 03 14:02:10 +0000 2018,Thank you to Congressman Tom Reed of New York for your wonderful comments on our great new Trade Deal with Mexico a… https://t.co/tuwwT7t11a
Wed Oct 03 13:23:34 +0000 2018,Thank you Governor Phil Bryant - it was my great honor to be there! #MAGA https://t.co/UbY7Qu2fMt
Wed Oct 03 13:16:08 +0000 2018,https://t.co/w04sqlMIYm
Wed Oct 03 13:04:02 +0000 2018,"The Stock Market just reached an All-Time High during my Administration for the 102nd Time, a presidential record,… https://t.co/eVO3pSBlLU"
Wed Oct 03 12:53:35 +0000 2018,The Failing New York Times did something I have never seen done before. They used the concept of “time value of mon… https://t.co/OaNSM7we21
Wed Oct 03 12:35:52 +0000 2018,"Congressman @PeteSessions of Texas is a true fighter and patriot. Highly respected in D.C. by all, he always gets w… https://t.co/8eQEIFxyEk"
Wed Oct 03 03:56:24 +0000 2018,"RT @DHSgov: REMINDER: Tomorrow, 10/3 at 2:18 PM EDT, there will be a nationwide test of the Wireless Emergency Alert system, in coordinatio…"
Wed Oct 03 02:58:22 +0000 2018,"Thank you Mississippi - Together, we are MAKING AMERICA GREAT AGAIN! https://t.co/npnRirjcFG"
Wed Oct 03 02:18:03 +0000 2018,"Today, my Administration provided HISTORIC levels of funding to improve school safety through STOP School Violence… https://t.co/oON7wPgrfA"
Wed Oct 03 02:15:03 +0000 2018,"“National wage growth is at the highest it’s been in nearly 17 months -- and, according to a new study released by… https://t.co/gpwphLJ17a"
Wed Oct 03 01:25:33 +0000 2018,GOD BLESS THE U.S.A.! #MAGA🇺🇸 https://t.co/pquqyy5S3G
Wed Oct 03 01:18:08 +0000 2018,Thank you Mississippi - I love you! https://t.co/eH6x1NBNQG
Tue Oct 02 21:20:05 +0000 2018,This is really an incredible time for our Nation - WE are RESPECTED AGAIN! https://t.co/94KusYcDAj
Tue Oct 02 21:17:08 +0000 2018,"RT @WhiteHouse: “America will always be a nation of great builders, because in America, we honor work, we honor grit, we honor craftsmanshi…"
Tue Oct 02 18:18:35 +0000 2018,“USMCA Wins Praise as a Victory for American Industries and Workers”➡️https://t.co/UWhPhNXiiL https://t.co/eBVv0nXXRT
Tue Oct 02 17:22:36 +0000 2018,Proud of our great First Lady - and she loves doing this! https://t.co/VD7wlqeJoR
Tue Oct 02 16:18:58 +0000 2018,"Yesterday, it was my great honor to present the Medal of Honor to Ronald J. Shurer II, for his actions on April 6,… https://t.co/syiAXrSbzA"
Tue Oct 02 16:08:25 +0000 2018,THE ONLY REASON TO VOTE FOR A DEMOCRAT IS IF YOU’RE TIRED OF WINNING!
Tue Oct 02 15:02:03 +0000 2018,Great reviews on the new USMCA. Thank you! Mexico and Canada will be wonderful partners in Trade (and more) long into the future.
Tue Oct 02 14:52:52 +0000 2018,"Happy 7th birthday to Tristan, a very special member of the Trump family!"
Tue Oct 02 00:50:23 +0000 2018,WOW - THANK YOU TENNESSEE! https://t.co/38UUDqfIz5
Tue Oct 02 00:37:49 +0000 2018,Thank you Tennessee - I love you! https://t.co/1swpoY7F5x
Tue Oct 02 00:25:44 +0000 2018,https://t.co/5UmYGFLyLK
Mon Oct 01 12:08:26 +0000 2018,News conference on the USMCA this morning at 11:00 - Rose Garden of White House.
Mon Oct 01 10:56:22 +0000 2018,Congratulations to Mexico and Canada!
Mon Oct 01 10:53:28 +0000 2018,"....deficiencies and mistakes in NAFTA, greatly opens markets to our Farmers and Manufacturers, reduces Trade Barri… https://t.co/2dzTdvz0gQ"
Mon Oct 01 10:30:08 +0000 2018,"Late last night, our deadline, we reached a wonderful new Trade Deal with Canada, to be added into the deal already… https://t.co/Dwe2KWvqgn"
Sun Sep 30 18:56:27 +0000 2018,"Wow! Just starting to hear the Democrats, who are only thinking Obstruct and Delay, are starting to put out the wor… https://t.co/9irOa5ox2R"
Sun Sep 30 17:47:03 +0000 2018,"So if African-American unemployment is now at the lowest number in history, median income the highest, and you then… https://t.co/HNyxfnk6ar"
Sun Sep 30 16:57:45 +0000 2018,"Like many, I don’t watch Saturday Night Live (even though I past hosted it) - no longer funny, no talent or charm.… https://t.co/oaM3Pq6Gmy"
Sun Sep 30 02:49:55 +0000 2018,"NBC News incorrectly reported (as usual) that I was limiting the FBI investigation of Judge Kavanaugh, and witnesse… https://t.co/lhsF1IAabe"
Sun Sep 30 00:52:25 +0000 2018,Thank you West Virginia - I love you! https://t.co/Ou2umCfKp9
Sun Sep 30 00:51:22 +0000 2018,https://t.co/BxlF4grr9k
Sat Sep 29 20:36:43 +0000 2018,"Heading to West Virginia now. Big Rally. Will be live on @FoxNews tonight. Long lines, but will be great!"
Sat Sep 29 20:33:51 +0000 2018,"Senator Richard Blumenthal must talk about his fraudulent service in Vietnam, where for 12 years he told the people… https://t.co/EAw5lZrDLJ"
Sat Sep 29 00:27:17 +0000 2018,"Just started, tonight, our 7th FBI investigation of Judge Brett Kavanaugh. He will someday be recognized as a truly… https://t.co/ORrMcJynvp"
Thu Sep 27 22:46:17 +0000 2018,"Judge Kavanaugh showed America exactly why I nominated him. His testimony was powerful, honest, and riveting. Democ… https://t.co/RYPP0I2x7P"
Wed Sep 26 23:52:51 +0000 2018,https://t.co/9o5gZlJiTd
Wed Sep 26 20:48:12 +0000 2018,"Join me this Saturday in Wheeling, West Virginia at 7pmE! Tickets: https://t.co/JyRaBps0eR https://t.co/hiruLIxa7w"
Wed Sep 26 20:47:16 +0000 2018,RT @WhiteHouse: President Trump and Prime Minister Theresa May met for a bilateral meeting in New York 🇺🇸 🇬🇧 https://t.co/VdJztUmD9T
Wed Sep 26 19:23:07 +0000 2018,"RT @WhiteHouse: This afternoon, President Trump participated in a bilateral meeting with Prime Minister Abe. 🇺🇸🇯🇵 https://t.co/PvSINQY7yq"
Wed Sep 26 19:23:03 +0000 2018,"RT @WhiteHouse: Earlier today, President Trump participated in a bilateral meeting with Prime Minister @netanyahu of Israel. 🇺🇸🇮🇱 https://t…"
Wed Sep 26 17:34:34 +0000 2018,"Congressman Lee Zeldin is doing a fantastic job in D.C. Tough and smart, he loves our Country and will always be th… https://t.co/B550BLwWtQ"
Wed Sep 26 17:31:40 +0000 2018,RT @PeteHegseth: This @realDonaldTrump speech to the #UNGA should be required viewing in American high schools. A beautiful articulation of…
Wed Sep 26 17:28:54 +0000 2018,"RT @newtgingrich: President Trump’s United Nations speech today is a remarkable outline of the power of patriotism, the importance of natio…"
Wed Sep 26 17:26:54 +0000 2018,"China is actually placing propaganda ads in the Des Moines Register and other papers, made to look like news. That’… https://t.co/pgamEgZq1x"
Wed Sep 26 16:47:06 +0000 2018,"Avenatti is a third rate lawyer who is good at making false accusations, like he did on me and like he is now doing… https://t.co/w6Medqx5FF"
Wed Sep 26 10:57:30 +0000 2018,Jobless Claims fell to their lowest level in 49 years!
Wed Sep 26 10:54:59 +0000 2018,"Consumer confidence hits an 18 year high, close to breaking the all-time record. A big jump from last 8 years. Peop… https://t.co/ftDZQ7LWuu"
Wed Sep 26 02:55:20 +0000 2018,The Democrats are playing a high level CON GAME in their vicious effort to destroy a fine person. It is called the… https://t.co/4Ma9JxNdi1
Wed Sep 26 02:38:54 +0000 2018,“These law enforcement people took the law into their own hands when it came to President Trump.” @LindseyGrahamSC
Tue Sep 25 22:06:33 +0000 2018,73rd Session of the United Nations General Assembly #UNGA https://t.co/xJyx7RrH5F
Tue Sep 25 20:27:25 +0000 2018,"“Consumer confidence rose in September, notching its highest level in about 18 years. The Consumer Board's index ro… https://t.co/YwjGz4Yu1Z"
Tue Sep 25 19:28:26 +0000 2018,“Remarks by President Trump at a Luncheon Hosted by the Secretary-General of the United Nations”… https://t.co/0WT3MdNMDi
Tue Sep 25 17:19:44 +0000 2018,“Remarks by President Trump to the 73rd Session of the United Nations General Assembly” ➡️https://t.co/Oshhko61zY https://t.co/Fm8LSse417
Tue Sep 25 16:45:36 +0000 2018,Rush Limbaugh to Republicans: “You can kiss the MIDTERMS goodbye if you don’t get highly qualified Kavanaugh approved.”
Tue Sep 25 16:37:43 +0000 2018,Thank you Dr. Jeffress! https://t.co/cm7NjQh0ti
Tue Sep 25 16:36:02 +0000 2018,Thank you Mark! https://t.co/NVGs6WbQe2
Tue Sep 25 15:27:35 +0000 2018,https://t.co/h43dehf0WV
Tue Sep 25 13:14:04 +0000 2018,Will be speaking at the United Nations this morning. Our country is much stronger and much richer than it was when… https://t.co/fCqzut4mRR
Tue Sep 25 10:53:41 +0000 2018,"Despite requests, I have no plans to meet Iranian President Hassan Rouhani. Maybe someday in the future. I am sure… https://t.co/SpuT7bsm9W"
Tue Sep 25 10:41:20 +0000 2018,Republican Party Favorability is the highest it has been in 7 years - 3 points higher than Democrats!  Gallup
Tue Sep 25 02:50:09 +0000 2018,"The Democrats are working hard to destroy a wonderful man, and a man who has the potential to be one of our greates… https://t.co/t6nJYLOXbG"
Tue Sep 25 02:38:39 +0000 2018,REMEMBER THE MIDTERMS!
Tue Sep 25 00:22:46 +0000 2018,https://t.co/FXqSWusSTV
