created_at,text
Thu Feb 22 01:40:33 +0000 2018,"I will always remember the time I spent today with courageous students, teachers and families. So much love in the… https://t.co/u8ZYPzhp2S"
Wed Feb 21 21:12:45 +0000 2018,.@FLOTUS Melania and I join millions of people around the world in mourning the passing of Billy Graham. Our prayer… https://t.co/Q8BrGTiHuP
Wed Feb 21 18:20:25 +0000 2018,"Yesterday, it was my great honor to recognize extraordinary Law Enforcement Officers and First Responders, and to a… https://t.co/PsfNaJrfEB"
Wed Feb 21 14:40:21 +0000 2018,"Question: If all of the Russian meddling took place during the Obama Administration, right up to January 20th, why… https://t.co/dquN8v8VwU"
Wed Feb 21 14:22:07 +0000 2018,The GREAT Billy Graham is dead. There was nobody like him! He will be missed by Christians and all religions. A very special man.
Wed Feb 21 01:18:36 +0000 2018,"@CNN @MSNBC Whether we are Republican or Democrat, we must now focus on strengthening Background Checks!"
Wed Feb 21 01:14:19 +0000 2018,"So true, thank you! https://t.co/9TTXlfokYz"
Wed Feb 21 01:08:00 +0000 2018,Bad ratings @CNN &amp; @MSNBC got scammed when they covered the anti-Trump Russia rally wall-to-wall. They probably kne… https://t.co/1s5PQaBe2g
Tue Feb 20 17:49:07 +0000 2018,"Main Street is BOOMING thanks to our incredible TAX CUT and Reform law. ""This shows small-business owners are more… https://t.co/gkJczuVCt6"
Tue Feb 20 15:29:07 +0000 2018,....cameras running. Another False Accusation. Why doesn’t @washingtonpost report the story of the women taking mon… https://t.co/OTpK1KLYOL
Tue Feb 20 15:16:06 +0000 2018,"A woman I don’t know and, to the best of my knowledge, never met, is on the FRONT PAGE of the Fake News Washington… https://t.co/lWlDMu6gxb"
Tue Feb 20 13:38:49 +0000 2018,"I have been much tougher on Russia than Obama, just look at the facts. Total Fake News!"
Tue Feb 20 13:11:58 +0000 2018,"Hope Republicans in the Great State of Pennsylvania challenge the new “pushed” Congressional Map, all the way to th… https://t.co/bT190oQKpM"
Tue Feb 20 13:03:53 +0000 2018,Matt Schlapp and CPAC are getting ready for another exciting event. Big difference from those days when President O… https://t.co/KxKVJL0Bc4
Tue Feb 20 12:54:39 +0000 2018,"Republicans are now leading the Generic Poll, perhaps because of the popular Tax Cuts which the Dems want to take a… https://t.co/TQfyR96KP8"
Tue Feb 20 12:46:18 +0000 2018,....The President Obama quote just before election. That’s because he thought Crooked Hillary was going to win and… https://t.co/59Wli8q1pN
Tue Feb 20 12:37:20 +0000 2018,"“There is no serious person out there who would suggest somehow that you could even rig America’s elections, there’… https://t.co/eJ9M6A2H50"
Tue Feb 20 12:24:54 +0000 2018,Thank you to @foxandfriends for the great timeline on all of the failures the Obama Administration had against Russ… https://t.co/SI7CxX4a7C
Tue Feb 20 02:48:02 +0000 2018,"“The Faith of Donald Trump,” a book just out by David Brody and Scott Lamb, is a very interesting read. Enjoy!"
Tue Feb 20 02:29:29 +0000 2018,"The U.S. economy is looking very good, in my opinion, even better than anticipated. Companies are pouring back into… https://t.co/Sxweprvk7N"
Tue Feb 20 02:21:08 +0000 2018,.@MittRomney has announced he is running for the Senate from the wonderful State of Utah. He will make a great Sena… https://t.co/h1RaVb2OVj
Mon Feb 19 19:55:49 +0000 2018,"Obama was President up to, and beyond, the 2016 Election. So why didn’t he do something about Russian meddling?"
Mon Feb 19 13:42:10 +0000 2018,"Have a great, but very reflective, President’s Day!"
Mon Feb 19 04:28:40 +0000 2018,"Just watched a very insecure Oprah Winfrey, who at one point I knew very well, interview a panel of people on 60 Mi… https://t.co/7iuf59562i"
Sun Feb 18 19:13:02 +0000 2018,"My great friends from NASCAR are having their big race today, The Daytona 500. Brian France and the France family a… https://t.co/EWBOQxPW2S"
Sun Feb 18 17:10:32 +0000 2018,"Thank you to KenStarr, former Independent Counsel, Whitewater, for your insight and powerful words on FISA abuse, R… https://t.co/XGIgUkn3qK"
Sun Feb 18 13:55:55 +0000 2018,Great Pollster John McLaughlin now has the GOP up in the Generic Congressional Ballot. Big gain over last 4 weeks.… https://t.co/iIrNmfPgbQ
Sun Feb 18 13:46:39 +0000 2018,The Fake News of big ratings loser CNN. https://t.co/rYsv90cnvs
Sun Feb 18 13:11:28 +0000 2018,"If it was the GOAL of Russia to create discord, disruption and chaos within the U.S. then, with all of the Committe… https://t.co/fx3CPabzTi"
Sun Feb 18 12:53:11 +0000 2018,"RT @mike_pence: Big night. Largest-ever Dallas County GOP Reagan Day Dinner. As I told the crowd, under President @realDonaldTrump: Promise…"
Sun Feb 18 12:43:48 +0000 2018,"Now that Adam Schiff is starting to blame President Obama for Russian meddling in the election, he is probably doin… https://t.co/R2OTHSUYP9"
Sun Feb 18 12:33:16 +0000 2018,"I never said Russia did not meddle in the election, I said “it may be Russia, or China or another country or group,… https://t.co/1dMjQbLlSC"
Sun Feb 18 12:22:29 +0000 2018,"Finally, Liddle’ Adam Schiff, the leakin’ monster of no control, is now blaming the Obama Administration for Russia… https://t.co/9HNsbaWwWj"
Sun Feb 18 12:02:52 +0000 2018,"Never gotten over the fact that Obama was able to send $1.7 Billion Dollars in CASH to Iran and nobody in Congress,… https://t.co/5nQ35ANIrg"
Sun Feb 18 04:22:48 +0000 2018,General McMaster forgot to say that the results of the 2016 election were not impacted or changed by the Russians a… https://t.co/ilaHKwf6Jy
Sun Feb 18 04:08:45 +0000 2018,Very sad that the FBI missed all of the many signals sent out by the Florida school shooter. This is not acceptable… https://t.co/yvvTEmad2e
Sat Feb 17 23:45:28 +0000 2018,"Just like they don’t want to solve the DACA problem, why didn’t the Democrats pass gun control legislation when the… https://t.co/c2gS0ByFUw"
Sat Feb 17 20:16:39 +0000 2018,“I have seen all of the Russian ads and I can say very definitively that swaying the election was *NOT* the main go… https://t.co/y4PVZ6KZqv
Sat Feb 17 20:11:32 +0000 2018,"The Fake News Media never fails. Hard to ignore this fact from the Vice President of Facebook Ads, Rob Goldman! https://t.co/XGC7ynZwYJ"
Sat Feb 17 19:46:48 +0000 2018,"Funny how the Fake News Media doesn’t want to say that the Russian group was formed in 2014, long before my run for… https://t.co/9BPo5EB5WN"
Sat Feb 17 19:36:14 +0000 2018,Deputy A.G. Rod Rosenstein stated at the News Conference: “There is no allegation in the indictment that any Americ… https://t.co/pPhsPl34Ie
Sat Feb 17 19:26:13 +0000 2018,"“Charges Deal Don A Big Win,” written by Michael Goodwin of the @nypost, succinctly states that “the Russians had n… https://t.co/yoFUA9PolC"
Sat Feb 17 19:04:43 +0000 2018,"Melania and I met such incredible people last night in Broward County, Florida. Will never forget them, or the evening!"
Sat Feb 17 04:53:13 +0000 2018,"Our entire Nation, w/one heavy heart, continues to pray for the victims &amp; their families in Parkland, FL. To teache… https://t.co/jR8THlLD5z"
Fri Feb 16 20:18:11 +0000 2018,"Russia started their anti-US campaign in 2014, long before I announced that I would run for President. The results… https://t.co/B4D7ZcKHPp"
Fri Feb 16 14:49:54 +0000 2018,Cannot believe how BADLY DACA recipients have been treated by the Democrats...totally abandoned! Republicans are still working hard.
Fri Feb 16 14:37:56 +0000 2018,I will be leaving for Florida today to meet with some of the bravest people on earth - but people whose lives have… https://t.co/1APUFLwj1f
Thu Feb 15 20:19:11 +0000 2018,"Presidential Proclamation Honoring the Victims of the Tragedy in Parkland, Florida: https://t.co/RTQWAKiSnR https://t.co/Nhs32bm5zB"
Thu Feb 15 19:26:09 +0000 2018,"...lottery, continues deadly catch-and-release, and bars enforcement even for FUTURE illegal immigrants. Voting for… https://t.co/ruP4vp9vxa"
Thu Feb 15 19:25:23 +0000 2018,The Schumer-Rounds-Collins immigration bill would be a total catastrophe. @DHSgov says it would be “the end of immi… https://t.co/FegRjpmNZj
Thu Feb 15 19:22:16 +0000 2018,"RT @SpoxDHS: Schumer-Rounds-Collins destroys the ability of @DHSgov to enforce immigration laws, creating a mass amnesty for over 10 millio…"
Thu Feb 15 17:33:41 +0000 2018,"In times of tragedy, the bonds that sustain us are those of family, faith, community, and country. These bonds are… https://t.co/LraxXxUN3D"
Thu Feb 15 14:57:21 +0000 2018,"While the Republicans and Democrats in Congress are working hard to come up with a solution to DACA, they should be… https://t.co/qti7gQGh0I"
Thu Feb 15 12:12:41 +0000 2018,"So many signs that the Florida shooter was mentally disturbed, even expelled from school for bad and erratic behavi… https://t.co/3mSYrtTng6"
Wed Feb 14 20:55:01 +0000 2018,Just spoke to Governor Rick Scott. We are working closely with law enforcement on the terrible Florida school shooting.
Wed Feb 14 20:50:11 +0000 2018,"My prayers and condolences to the families of the victims of the terrible Florida shooting. No child, teacher or an… https://t.co/RFJxgM1jhm"
Wed Feb 14 19:11:32 +0000 2018,"Today, I was honored to be joined by Republicans and Democrats from both the House and Senate, as well as members o… https://t.co/38kUIIV8Cp"
Wed Feb 14 18:15:12 +0000 2018,"As we come together to celebrate the extraordinary contributions of African-Americans to our nation, our thoughts t… https://t.co/SwAJxO88zC"
Tue Feb 13 10:52:47 +0000 2018,Negotiations on DACA have begun. Republicans want to make a deal and Democrats say they want to make a deal. Wouldn… https://t.co/YW4mCpHr0R
Tue Feb 13 10:43:22 +0000 2018,"Our infrastructure plan has been put forward and has received great reviews by everyone except, of course, the Demo… https://t.co/2EfB9sObdN"
Mon Feb 12 20:48:16 +0000 2018,The journey to #MAGA began @CPAC 2011 and the opportunity to reconnect with friends and supporters is something I l… https://t.co/DSz3Szp4xE
Mon Feb 12 12:54:32 +0000 2018,"Thank you to Sue Kruczek, who lost her wonderful and talented son Nick to the Opioid scourge, for your kind words w… https://t.co/0kIdepXBdi"
Mon Feb 12 12:46:56 +0000 2018,"This will be a big week for Infrastructure. After so stupidly spending $7 trillion in the Middle East, it is now ti… https://t.co/OcX7UN18Er"
Sun Feb 11 20:36:08 +0000 2018,Just spoke to @JohnKasich to express condolences and prayers to all for the horrible shooting of two great police o… https://t.co/X7AhuEYwHI
Sun Feb 11 20:26:03 +0000 2018,"Rep. Lou Barletta, a Great Republican from Pennsylvania who was one of my very earliest supporters, will make a FAN… https://t.co/dA2lK3WHFU"
Sun Feb 11 19:15:32 +0000 2018,4.2 million hard working Americans have already received a large Bonus and/or Pay Increase because of our recently… https://t.co/oJl5AiCPZs
Sun Feb 11 18:21:48 +0000 2018,So many positive things going on for the U.S.A. and the Fake News Media just doesn’t want to go there. Same negativ… https://t.co/LBnzRfAkJx
Sat Feb 10 23:34:08 +0000 2018,"My Administration has identified three major priorities for creating a safe, modern and lawful immigration system:… https://t.co/DrjXUak41S"
Sat Feb 10 21:18:23 +0000 2018,"My thoughts and prayers are with the two police officers, their families, and everybody at the @WestervillePD. https://t.co/AoingY77Ky"
Sat Feb 10 18:50:02 +0000 2018,Republicans want to fix DACA far more than the Democrats do. The Dems had all three branches of government back in… https://t.co/0Or3U2CFZR
Sat Feb 10 18:34:49 +0000 2018,"....agencies, not just the FBI &amp; DOJ, now the State Department to dig up dirt on him in the days leading up to the… https://t.co/Of9d7fmsA3"
Sat Feb 10 18:16:20 +0000 2018,“My view is that not only has Trump been vindicated in the last several weeks about the mishandling of the Dossier… https://t.co/dWJuKECfwn
Sat Feb 10 15:33:35 +0000 2018,Peoples lives are being shattered and destroyed by a mere allegation. Some are true and some are false. Some are ol… https://t.co/6Zz5RAeoQe
Sat Feb 10 15:20:05 +0000 2018,"According to the @nytimes, a Russian sold phony secrets on “Trump” to the U.S. Asking price was $10 million, brough… https://t.co/CBMaAX5VMt"
Sat Feb 10 14:20:35 +0000 2018,"The Democrats sent a very political and long response memo which they knew, because of sources and methods (and mor… https://t.co/iR1265rmh3"
Sat Feb 10 14:02:54 +0000 2018,Jobless claims have dropped to a 45 year low!
Fri Feb 09 13:59:13 +0000 2018,"Costs on non-military lines will never come down if we do not elect more Republicans in the 2018 Election, and beyo… https://t.co/WgvQYGEaMu"
Fri Feb 09 13:47:28 +0000 2018,"Without more Republicans in Congress, we were forced to increase spending on things we do not like or want in order… https://t.co/7dfsJYWjRY"
Fri Feb 09 13:39:15 +0000 2018,Just signed Bill. Our Military will now be stronger than ever before. We love and need our Military and gave them e… https://t.co/9MtCabhzj8
Fri Feb 09 03:22:53 +0000 2018,Wow! -Senator Mark Warner got caught having extensive contact with a lobbyist for a Russian oligarch. Warner did no… https://t.co/N5SoaLnllm
Thu Feb 08 23:26:22 +0000 2018,Time to end the visa lottery. Congress must secure the immigration system and protect Americans. https://t.co/yukxm48x9X
Thu Feb 08 20:10:58 +0000 2018,As long as we open our eyes to God’s grace - and open our hearts to God’s love - then America will forever be the l… https://t.co/wGUIaD1JX6
Thu Feb 08 18:44:00 +0000 2018,"I will be meeting with Henry Kissinger at 1:45pm. Will be discussing North Korea, China and the Middle East."
Thu Feb 08 17:13:13 +0000 2018,Our founders invoked our Creator four times in the Declaration of Independence. Our currency declares “IN GOD WE TR… https://t.co/q8ib233y1M
Thu Feb 08 11:08:39 +0000 2018,Will be heading over shortly to make remarks at The National Prayer Breakfast in Washington. Great religious and po… https://t.co/bEReTLNLo4
Wed Feb 07 22:36:15 +0000 2018,The Budget Agreement today is so important for our great Military. It ends the dangerous sequester and gives Secret… https://t.co/VRkKsNDZGC
Wed Feb 07 22:13:16 +0000 2018,Congratulations to the Republic of Korea on what will be a MAGNIFICENT Winter Olympics! What the South Korean peopl… https://t.co/gGaZUnZBMa
Wed Feb 07 18:01:05 +0000 2018,Best wishes to the Republic of Korea on hosting the @Olympics! What a wonderful opportunity to show everyone that y… https://t.co/NL6cIfHZgN
Wed Feb 07 16:10:00 +0000 2018,NEW FBI TEXTS ARE BOMBSHELLS!
Wed Feb 07 14:59:49 +0000 2018,"In the “old days,” when good news was reported, the Stock Market would go up. Today, when good news is reported, th… https://t.co/mW5vEWhZYY"
Wed Feb 07 03:05:45 +0000 2018,"Congratulations @ElonMusk and @SpaceX on the successful #FalconHeavy launch. This achievement, along with @NASA’s c… https://t.co/MaQocjQKcI"
Wed Feb 07 00:48:01 +0000 2018,"HAPPY BIRTHDAY to our 40th President of the United States of America, Ronald Reagan! https://t.co/JtEglBhm4c"
Tue Feb 06 22:45:50 +0000 2018,"Today, we heard the experiences of law enforcement professionals and community leaders working to combat the threat… https://t.co/BAHG9Ajkio"
Tue Feb 06 16:05:42 +0000 2018,We need a 21st century MERIT-BASED immigration system.  Chain migration and the visa lottery are outdated programs… https://t.co/5SzmbuLXuY
Tue Feb 06 16:00:43 +0000 2018,"Polling shows nearly 7 in 10 Americans support an immigration reform package that includes DACA, fully secures the… https://t.co/OD93mZebu7"
Tue Feb 06 13:37:00 +0000 2018,"My prayers and best wishes are with the family of Edwin Jackson, a wonderful young man whose life was so senselessly taken. @Colts"
Tue Feb 06 13:32:57 +0000 2018,So disgraceful that a person illegally in our country killed @Colts linebacker Edwin Jackson. This is just one of m… https://t.co/r8vqtb4Tjb
Mon Feb 05 20:42:01 +0000 2018,"Thanks to the historic TAX CUTS that I signed into law, your paychecks are going way UP, your taxes are going way D… https://t.co/DKVuox1qa6"
Mon Feb 05 15:08:51 +0000 2018,"Representative Devin Nunes, a man of tremendous courage and grit, may someday be recognized as a Great American Her… https://t.co/p7egMdnqQs"
Mon Feb 05 14:36:40 +0000 2018,Any deal on DACA that does not include STRONG border security and the desperately needed WALL is a total waste of t… https://t.co/BuGrQqbWfs
Mon Feb 05 12:39:10 +0000 2018,"Little Adam Schiff, who is desperate to run for higher office, is one of the biggest liars and leakers in Washingto… https://t.co/7csaXTJLoO"
Mon Feb 05 12:17:57 +0000 2018,Thank you to @foxandfriends for exposing the truth. Perhaps that’s why your ratings are soooo much better than your untruthful competition!
Mon Feb 05 12:11:56 +0000 2018,The Democrats are pushing for Universal HealthCare while thousands of people are marching in the UK because their U… https://t.co/9JK8HHq2bb
Mon Feb 05 03:54:42 +0000 2018,Congratulations to the Philadelphia Eagles on a great Super Bowl victory!
Sun Feb 04 16:58:14 +0000 2018,My thoughts and prayers are with all of the victims involved in this mornings train collision in South Carolina. Th… https://t.co/H3Ypk1ZwMt
Sun Feb 04 00:53:18 +0000 2018,...a tool of anti-Trump political actors. This is unacceptable in a democracy and ought to alarm anyone who wants t… https://t.co/tGnYODCVQx
Sun Feb 04 00:40:24 +0000 2018,“The four page memo released Friday reports the disturbing fact about how the FBI and FISA appear to have been used… https://t.co/ZT9YHhTIlA
Sun Feb 04 00:26:23 +0000 2018,"Great jobs numbers and finally, after many years, rising wages- and nobody even talks about them. Only Russia, Russ… https://t.co/0gYGNuj0BS"
Sat Feb 03 14:40:27 +0000 2018,This memo totally vindicates “Trump” in probe. But the Russian Witch Hunt goes on and on. Their was no Collusion an… https://t.co/GPYj4JbKgN
Sat Feb 03 14:40:23 +0000 2018,"Rasmussen just announced that my approval rating jumped to 49%, a far better number than I had in winning the Elect… https://t.co/GbG8u70wTV"
Sat Feb 03 13:44:19 +0000 2018,RT @EricTrump: #MakeAmericaGreatAgain 🇺🇸🇺🇸🇺🇸 https://t.co/CJts3udtNO
Sat Feb 03 13:39:49 +0000 2018,RT @EricTrump: 🇺🇸🇺🇸🇺🇸 https://t.co/iszxYp036c
Fri Feb 02 22:26:22 +0000 2018,"Today, it was my honor to join the great men and women of @DHSgov, @CustomsBorder, @ICEgov and @USCIS at the U.S. C… https://t.co/r9EL0AhbO1"
Fri Feb 02 18:07:08 +0000 2018,“Trump the orator outlines the greatness of America to Democrats’ disgust” https://t.co/XpirrtTY6V
Fri Feb 02 18:05:49 +0000 2018,"With 3.5 million Americans receiving bonuses or other benefits from their employers as a result of TAX CUTS, 2018 i… https://t.co/cxo1rxdDsj"
Fri Feb 02 11:49:14 +0000 2018,“You had Hillary Clinton and the Democratic Party try to hide the fact that they gave money to GPS Fusion to create… https://t.co/A8GoOzBrPx
Fri Feb 02 11:33:58 +0000 2018,The top Leadership and Investigators of the FBI and the Justice Department have politicized the sacred investigativ… https://t.co/xXWIyOvhi0
Fri Feb 02 03:32:48 +0000 2018,"The Democrats just aren’t calling about DACA. Nancy Pelosi and Chuck Schumer have to get moving fast, or they’ll di… https://t.co/Tuz4PCoIF4"
Thu Feb 01 12:02:49 +0000 2018,Thank you for all of the nice compliments and reviews on the State of the Union speech. 45.6 million people watched… https://t.co/HKFLkRjlGQ
Thu Feb 01 11:51:43 +0000 2018,"March 5th is rapidly approaching and the Democrats are doing nothing about DACA. They Resist, Blame, Complain and O… https://t.co/A4qhFRv21V"
Thu Feb 01 11:43:17 +0000 2018,Heading to beautiful West Virginia to be with great members of the Republican Party. Will be planning Infrastructur… https://t.co/17g1hxSFRI
Wed Jan 31 02:00:02 +0000 2018,"Join me live for the #SOTU
https://t.co/0SLktWxfHi"
Mon Jan 29 20:12:39 +0000 2018,"Congratulations to America’s new Secretary of @HHSGov, Alex Azar! https://t.co/Y9inQaCt7o"
Sun Jan 28 13:18:33 +0000 2018,Our economy is better than it has been in many decades. Businesses are coming back to America like never before. Ch… https://t.co/ZrThpTutNr
Sun Jan 28 13:18:32 +0000 2018,"Somebody please inform Jay-Z that because of my policies, Black Unemployment has just been reported to be at the LOWEST RATE EVER RECORDED!"
Sun Jan 28 04:08:02 +0000 2018,Democrats are not interested in Border Safety &amp; Security or in the funding and rebuilding of our Military. They are… https://t.co/wM9cL8CBo7
Sun Jan 28 03:58:02 +0000 2018,"I have offered DACA a wonderful deal, including a doubling in the number of recipients &amp; a twelve year pathway to c… https://t.co/gSxSjiRcoC"
Sat Jan 27 22:59:52 +0000 2018,"Taliban targeted innocent Afghans, brave police in Kabul today. Our thoughts and prayers go to the victims, and fir… https://t.co/nxuDZV0VYZ"
Sat Jan 27 19:30:24 +0000 2018,"On Holocaust Remembrance Day we mourn and grieve the murder of 6 million innocent Jewish men, women and children, a… https://t.co/Df8jIU5KW2"
Sat Jan 27 11:55:58 +0000 2018,Thank you to Brandon Judd of the National Border Patrol Council for his strong statement on @foxandfriends that we… https://t.co/33QbAoLFxj
Fri Jan 26 23:27:23 +0000 2018,Thank you for the wonderful welcome @WEF! #Davos2018 https://t.co/IQkoQJxR5B
Fri Jan 26 17:16:44 +0000 2018,DACA has been made increasingly difficult by the fact that Cryin’ Chuck Schumer took such a beating over the shutdo… https://t.co/5faBeqcNP9
Fri Jan 26 17:12:32 +0000 2018,"Heading back from a very exciting two days in Davos, Switzerland. Speech on America’s economic revival was well rec… https://t.co/JbNNrNVH9z"
Fri Jan 26 12:54:36 +0000 2018,"Join me live at the 2018 World Economic Forum in Davos, Switzerland! #WEF18 https://t.co/fdHejCmv73 https://t.co/DuKJlVTWB8"
Fri Jan 26 11:23:07 +0000 2018,Great bilateral meeting with President @Alain_Berset of the Swiss Confederation - as we continue to strengthen our… https://t.co/3bK58PuFPd
Fri Jan 26 10:46:48 +0000 2018,"It was an honor to meet with Republic of Rwanda President Paul Kagame this morning in Davos, Switzerland. Many grea… https://t.co/tiD5NSYYwB"
Fri Jan 26 10:11:26 +0000 2018,"Will be interviewed on  @SquawkCNBC by @JoeSquawk coming up at 6:00amE from Davos, Switzerland. Enjoy! #WEF18 https://t.co/7egYlxnFBd"
Thu Jan 25 22:38:21 +0000 2018,"Today, Americans everywhere remember the brave men and women of @NASA who lost their lives in our Nation’s eternal… https://t.co/KMP2MhJVLS"
Thu Jan 25 18:03:29 +0000 2018,"Very productive bilateral meeting with Prime Minister Benjamin @Netanyahu of Israel - in Davos, Switzerland! #WEF18 https://t.co/2sZM9YI7tJ"
Thu Jan 25 17:25:53 +0000 2018,"Great bilateral meeting with Prime Minister Theresa May of the United Kingdom, affirming the special relationship a… https://t.co/6bIzOEo8DK"
Thu Jan 25 00:27:00 +0000 2018,"Will soon be heading to Davos, Switzerland, to tell the world how great America is and is doing. Our economy is now… https://t.co/OwSYSiCiKe"
Wed Jan 24 22:51:20 +0000 2018,It was my great honor to welcome Mayor’s from across America to the WH. My Administration will always support local… https://t.co/N7Z9Dw3uIi
Wed Jan 24 20:26:16 +0000 2018,"Earlier today, I spoke with @GovMattBevin of Kentucky regarding yesterday’s shooting at Marshall County High School… https://t.co/20Bf0p7oFT"
Wed Jan 24 11:58:58 +0000 2018,Tremendous investment by companies from all over the world being made in America. There has never been anything lik… https://t.co/sUp4LsbXhz
Wed Jan 24 04:07:27 +0000 2018,"Cryin’ Chuck Schumer fully understands, especially after his humiliating defeat, that if there is no Wall, there is… https://t.co/oaabUSfT9w"
Wed Jan 24 03:54:22 +0000 2018,"Where are the 50,000 important text messages between FBI lovers Lisa Page and Peter Strzok?  Blaming Samsung!"
Tue Jan 23 14:16:02 +0000 2018,"Thank you to General John Kelly, who is doing a fantastic job, and all of the Staff and others in the White House,… https://t.co/q4hhzEEjor"
Tue Jan 23 13:34:37 +0000 2018,"Nobody knows for sure that the Republicans &amp; Democrats will be able to reach a deal on DACA by February 8, but ever… https://t.co/2qBHLtCo1u"
Tue Jan 23 11:55:42 +0000 2018,"In one of the biggest stories in a long time, the FBI now says it is missing five months worth of lovers Strzok-Pag… https://t.co/Zwg2yDeEwz"
Tue Jan 23 11:31:40 +0000 2018,Even Crazy Jim Acosta of Fake News CNN agrees: “Trump World and WH sources dancing in end zone: Trump wins again...… https://t.co/X4ncbncUqi
Tue Jan 23 04:30:33 +0000 2018,"Big win for Republicans as Democrats cave on Shutdown. Now I want a big win for everyone, including Republicans, De… https://t.co/jzJKY5vaAz"
Mon Jan 22 15:13:18 +0000 2018,End the Democrats Obstruction! https://t.co/tzBXilvW1b
Mon Jan 22 13:15:55 +0000 2018,Democrats have shut down our government in the interests of their far left base. They don’t want to do it but are powerless!
Mon Jan 22 13:07:09 +0000 2018,The Democrats are turning down services and security for citizens in favor of services and security for non-citizens. Not good!
Mon Jan 22 01:21:42 +0000 2018,Thank you to Brad Blakeman on @FoxNews for grading year one of my presidency with an “A”-and likewise to Doug Schoe… https://t.co/RnE8Gh9xnh
Sun Jan 21 12:35:28 +0000 2018,Great to see how hard Republicans are fighting for our Military and Safety at the Border. The Dems just want illega… https://t.co/px3zwtzYOV
