created_at,text
Fri Aug 03 22:43:03 +0000 2018,"NASA, which is making a BIG comeback under the Trump Administration, has just named 9 astronauts for Boeing and Spa… https://t.co/PTWvb661pi"
Fri Aug 03 22:10:35 +0000 2018,July is just the ninth month since 1970 that unemployment has fallen below 4%. Our economy has added 3.7 million jo… https://t.co/SKGTd06z9d
Fri Aug 03 22:00:39 +0000 2018,Marsha Blackburn had a BIG win last night in the Tennessee primary for U.S. Senate. She is an outstanding person &amp;… https://t.co/PCAZu1wCcN
Fri Aug 03 20:31:52 +0000 2018,“Pastor praises Trump as 'pro-black' at prison reform event” https://t.co/xFKf1arebx
Fri Aug 03 18:50:03 +0000 2018,"RT @Rasmussen_Poll: Today’s @realDonaldTrump approval ratings among black voters: 29%
 
This time last year: 15%

https://t.co/mazBCWoIMy @…"
Fri Aug 03 17:39:06 +0000 2018,Congratulations Marsha! https://t.co/JSMiOWfbxa
Fri Aug 03 14:21:48 +0000 2018,Congratulations to Bill Lee of Tennessee on his big primary win for Governor last night.  He ran a great campaign a… https://t.co/RpRxCjjIZe
Fri Aug 03 00:30:28 +0000 2018,Thank you Pennsylvania. I love you! https://t.co/qoswnBZb3f
Thu Aug 02 20:24:33 +0000 2018,They asked my daughter Ivanka whether or not the media is the enemy of the people. She correctly said no. It is the… https://t.co/c4TGr2TQe5
Thu Aug 02 19:08:37 +0000 2018,Looking forward to being in the Great State of Ohio on Saturday night where I will be campaigning hard for a truly… https://t.co/fcU4sbS0NN
Thu Aug 02 18:57:44 +0000 2018,When the House and Senate meet on the very important Farm Bill – we love our farmers - hopefully they will be able… https://t.co/z537Jg1Jx4
Thu Aug 02 18:55:23 +0000 2018,"Pennsylvania has to love Trump because unlike all of the others before me, I am bringing STEEL BACK in a VERY BIG w… https://t.co/teAi1NPQak"
Thu Aug 02 18:53:58 +0000 2018,Looking forward to being in the Great State of Pennsylvania where we had a tremendous victory in the Election. Will… https://t.co/9is51MvtVx
Thu Aug 02 17:23:50 +0000 2018,"Working hard, thank you! https://t.co/pNXbFNcf8z"
Thu Aug 02 11:04:04 +0000 2018,"Wow, @foxandfriends is blowing away the competition in the morning ratings. Morning Joe is a dead show with very fe… https://t.co/7xKz5N2daJ"
Thu Aug 02 10:38:15 +0000 2018,"Charles Koch of Koch Brothers, who claims to be giving away millions of dollars to politicians even though I know v… https://t.co/uXZSjDvJdn"
Thu Aug 02 04:47:25 +0000 2018,Thank you to Chairman Kim Jong Un for keeping your word &amp; starting the process of sending home the remains of our g… https://t.co/4iGfI1n2FK
Thu Aug 02 04:38:15 +0000 2018,"Congratulations to  @GreggJarrett on The TREMENDOUS success of his just out book, “The Russia Hoax, The Illicit Sch… https://t.co/V8dz7z4Xpq"
Thu Aug 02 03:40:24 +0000 2018,RT @realDonaldTrump: “Worker pay rate hits highest level since 2008” https://t.co/pMDxHQqcg9
Thu Aug 02 03:32:14 +0000 2018,Incredibly beautiful ceremony as U.S. Korean War remains are returned to American soil. Thank you to Honolulu and a… https://t.co/9HJXv49oCg
Wed Aug 01 21:16:11 +0000 2018,"“Private payrolls boom in July, increasing by 219,000 vs 185,000 estimate: ADP” https://t.co/SeU9kGpima"
Wed Aug 01 21:04:18 +0000 2018,"Join me tomorrow night at 7pmE in Wilkes-Barre Township, Pennsylvania for a MAKE AMERICA GREAT AGAIN RALLY! Tickets… https://t.co/4L1YE6X4Ew"
Wed Aug 01 19:22:01 +0000 2018,#PledgeToAmericasWorkers https://t.co/qIJQfQ3bos
Wed Aug 01 18:55:56 +0000 2018,It was my great honor to be joined by leading pastors and faith leaders from across our Nation today at the… https://t.co/kQbHcDSqNi
Wed Aug 01 15:56:31 +0000 2018,"“We already have a smoking gun about a campaign getting dirt on their opponent, it was Hillary Clinton. How is it O… https://t.co/qiLsNEdAct"
Wed Aug 01 15:35:47 +0000 2018,"Looking back on history, who was treated worse, Alfonse Capone, legendary mob boss, killer and “Public Enemy Number… https://t.co/oJProVNYVj"
Wed Aug 01 14:01:53 +0000 2018,"Russian Collusion with the Trump Campaign, one of the most successful in history, is a TOTAL HOAX. The Democrats pa… https://t.co/BAyz1DuKKq"
Wed Aug 01 13:34:03 +0000 2018,"Paul Manafort worked for Ronald Reagan, Bob Dole and many other highly prominent and respected political leaders. H… https://t.co/9om7OoFhfP"
Wed Aug 01 13:24:03 +0000 2018,"..This is a terrible situation and Attorney General Jeff Sessions should stop this Rigged Witch Hunt right now, bef… https://t.co/dI69iTTQOS"
Wed Aug 01 13:15:24 +0000 2018,.....remain in the FBI while he himself was being investigated. This is a real issue. It won’t go into a Mueller Re… https://t.co/6PVaj5H5MB
Wed Aug 01 13:03:08 +0000 2018,“FBI Agent Peter Strzok (on the Mueller team) should have recused himself on day one. He was out to STOP THE ELECTI… https://t.co/uAzDpT2o5o
Wed Aug 01 01:37:04 +0000 2018,RT @EricTrump: #Truth @Acosta https://t.co/aCfFoeqL1f
Wed Aug 01 00:24:25 +0000 2018,"Thank you Florida. I love you!
https://t.co/M5T81DZVUU"
Tue Jul 31 22:50:10 +0000 2018,RT @WhiteHouse: President Trump Delivers Remarks on Workforce Development https://t.co/nE2kMxkHyw
Tue Jul 31 20:49:25 +0000 2018,"On my way to Tampa, Florida. Look forward to seeing everyone soon! https://t.co/BSB6IjBK7r"
Tue Jul 31 20:39:22 +0000 2018,“Worker pay rate hits highest level since 2008” https://t.co/pMDxHQqcg9
Tue Jul 31 17:33:48 +0000 2018,"...Border Security is National Security, and National Security is the long-term viability of our Country. A Governm… https://t.co/TdZKJYoDqs"
Tue Jul 31 17:33:47 +0000 2018,"I don’t care what the political ramifications are, our immigration laws and border security have been a complete an… https://t.co/eYFA8HcawS"
Tue Jul 31 17:13:32 +0000 2018,.@SenJohnBarrasso has a Primary on August 21st. He doesn’t need any help because he is absolutely outstanding in ev… https://t.co/2Blnf1uaYD
Tue Jul 31 17:09:50 +0000 2018,Congressman David Kustoff has been a champion for the Trump Agenda - I greatly appreciate his support. David is str… https://t.co/d5UhHHfwf1
Tue Jul 31 13:34:47 +0000 2018,"The Fake News Media is going CRAZY! They are totally unhinged and in many ways, after witnessing first hand the dam… https://t.co/xCMRokHLNf"
Tue Jul 31 12:21:48 +0000 2018,"Will be in Tampa tonight. A big year for @RepDeSantis, who will be a great governor for Florida. Strong on Crime, B… https://t.co/Sp7rFPMTSN"
Tue Jul 31 12:03:30 +0000 2018,"I am looking into 3-D Plastic Guns being sold to the public. Already spoke to NRA, doesn’t seem to make much sense!"
Tue Jul 31 11:58:58 +0000 2018,"Collusion is not a crime, but that doesn’t matter because there was No Collusion (except by Crooked Hillary and the Democrats)!"
Tue Jul 31 11:00:41 +0000 2018,"One of the reasons we need Great Border Security is that Mexico’s murder rate in 2017 increased by 27% to 31,174 pe… https://t.co/eGmgZaVCXd"
Tue Jul 31 10:50:28 +0000 2018,Rush Limbaugh is a great guy who truly gets it!
Tue Jul 31 10:30:23 +0000 2018,"RT @dougmillsnyt: .@realDonaldTrump walks with Giuseppe Conte, Prime Minister of the Italy following a joint news conference in the East Ro…"
Tue Jul 31 10:29:59 +0000 2018,RT @dougmillsnyt: .@realDonaldTrump pumps his fist after his new Secretary of Veterans Affairs  Robert Wilkie is sworn-in by @VP Mike Pence…
Tue Jul 31 10:23:41 +0000 2018,"....them richer. Their network is highly overrated, I have beaten them at every turn. They want to protect their co… https://t.co/uFUpN1KZVk"
Tue Jul 31 10:14:18 +0000 2018,"The globalist Koch Brothers, who have become a total joke in real Republican circles, are against Strong Borders an… https://t.co/BSSlqc8ziq"
Tue Jul 31 02:01:02 +0000 2018,MAKING AMERICA GREAT AGAIN! https://t.co/OnMGXvldVT
Tue Jul 31 00:56:16 +0000 2018,A highly respected Federal judge today stated that the “Trump Administration gets great credit” for reuniting illeg… https://t.co/PmUINsU4gS
Mon Jul 30 22:44:12 +0000 2018,"Congratulations to our new @DeptVetAffairs Secretary, Robert Wilkie! https://t.co/6erqWJzuiK"
Mon Jul 30 22:36:02 +0000 2018,"Thank you to @RandPaul for your YES on a future great Justice of the Supreme Court, Brett Kavanaugh. Your vote mean… https://t.co/lg6IXxNCXU"
Mon Jul 30 22:34:22 +0000 2018,"...that Open Borders, large scale Crime, and abolishing ICE is good for them, we must get smart and finally do what… https://t.co/9pMVWYu2MR"
Mon Jul 30 22:34:21 +0000 2018,"Illegal immigration is a top National Security problem. After decades of playing games, with the whole World laughi… https://t.co/4PueWN0YWA"
Mon Jul 30 22:31:20 +0000 2018,"Congratulations to Judge Jeanine on the tremendous success of her new #1 best-selling book, “Liars, Leakers, and Li… https://t.co/WvTFOqhuhb"
Mon Jul 30 22:29:06 +0000 2018,"RT @realDonaldTrump: ...John is strong on crime and borders, loves our Military, our Vets and our Second Amendment. He will be a star. He h…"
Mon Jul 30 22:29:05 +0000 2018,"RT @realDonaldTrump: .@JohnJamesMI, who is running in the Republican Primary in the great state of Michigan, is SPECTACULAR! Vote on August…"
Mon Jul 30 22:28:21 +0000 2018,"...your Social Security and Medicare! Cast your early vote, or vote on August 7th, Election Day. He has my full and total Endorsement!"
Mon Jul 30 22:28:20 +0000 2018,.@Troy_Balderson of Ohio is running for Congress - so important to the Republican Party. Troy is strong on crime an… https://t.co/uo6R9b8c5U
Mon Jul 30 21:20:37 +0000 2018,Congratulations to General John Kelly. Today we celebrate his first full year as @WhiteHouse Chief of Staff! https://t.co/JWCaJ3GhHV
Mon Jul 30 19:31:31 +0000 2018,🇺🇸🇮🇹 https://t.co/1SSUCRtMEE
Mon Jul 30 17:22:27 +0000 2018,It is my great honor to welcome Prime Minister @GiuseppeConteIT of Italy to the @WhiteHouse! Join us at 2:00pmE for… https://t.co/Vw6ARIORDA
Mon Jul 30 12:06:39 +0000 2018,"RT @GOPChairwoman: “David Burritt, U.S. Steel's president and CEO, said the company was experiencing a ‘renaissance’ and credited @realDona…"
Mon Jul 30 11:57:34 +0000 2018,"We must have Border Security, get rid of Chain, Lottery, Catch &amp; Release Sanctuary Cities - go to Merit based Immig… https://t.co/7nTzbVrU6H"
Sun Jul 29 23:04:20 +0000 2018,RT @Scavino45: “@realDonaldTrump tells @ICEgov agents: ‘We always will stand with you’” https://t.co/o1P17H7IVq
Sun Jul 29 20:20:39 +0000 2018,"....Also, why is Mueller only appointing Angry Dems, some of whom have worked for Crooked Hillary, others, includin… https://t.co/hX52XFQ91d"
Sun Jul 29 20:12:15 +0000 2018,"Is Robert Mueller ever going to release his conflicts of interest with respect to President Trump, including the fa… https://t.co/t0GHh6hsEg"
Sun Jul 29 19:35:14 +0000 2018,"There is No Collusion! The Robert Mueller Rigged Witch Hunt, headed now by 17 (increased from 13, including an Obam… https://t.co/mtUqvuvzZD"
Sun Jul 29 19:09:19 +0000 2018,...and the Amazon Washington Post do nothing but write bad stories even on very positive achievements - and they will never change!
Sun Jul 29 19:09:18 +0000 2018,"...dying newspaper industry. No matter how much they try to distract and cover it up, our country is making great p… https://t.co/UVMw8JEf8i"
Sun Jul 29 19:09:18 +0000 2018,"...accurately. 90% of media coverage of my Administration is negative, despite the tremendously positive results we… https://t.co/zJALBDV4mc"
Sun Jul 29 19:09:17 +0000 2018,When the media - driven insane by their Trump Derangement Syndrome - reveals internal deliberations of our governme… https://t.co/0raeGd6mk4
Sun Jul 29 13:13:59 +0000 2018,"I would be willing to “shut down” government if the Democrats do not give us the votes for Border Security, which i… https://t.co/Tt1F0wywhv"
Sun Jul 29 12:42:52 +0000 2018,The biggest and best results coming out of the good GDP report was that the quarterly Trade Deficit has been reduce… https://t.co/CVPlukxPvK
Sun Jul 29 12:30:04 +0000 2018,"Had a very good and interesting meeting at the White House with A.G. Sulzberger, Publisher of the New York Times. S… https://t.co/GqF86BfAZp"
Sun Jul 29 12:00:13 +0000 2018,RT @realDonaldTrump: Congressman David Kustoff has been a champion for the Trump Agenda - I greatly appreciate his support. David is strong…
Sun Jul 29 11:59:30 +0000 2018,"RT @realDonaldTrump: The only things the Democrats do well is “Resist,” which is their campaign slogan, and “Obstruct.” Cryin’ Chuck Schume…"
Sun Jul 29 11:59:26 +0000 2018,"RT @realDonaldTrump: Democrats, who want Open Borders and care little about Crime, are incompetent, but they have the Fake News Media almos…"
Sun Jul 29 11:58:09 +0000 2018,"Please understand, there are consequences when people cross our Border illegally, whether they have children or not… https://t.co/mk2NZZX0au"
Sun Jul 29 11:52:49 +0000 2018,Do you think the Fake News Media will ever report on this tweet from Michael? https://t.co/kXLCKZO5Fr
Sun Jul 29 11:44:00 +0000 2018,"Wow, highest Poll Numbers in the history of the Republican Party. That includes Honest Abe Lincoln and Ronald Reaga… https://t.co/fGyiF6AmKT"
Sun Jul 29 11:31:52 +0000 2018,"Tom Homan, fmr ICE Director: “There is nobody that has done more for border security &amp; public safety than President… https://t.co/zM2UfKpJR2"
Sat Jul 28 16:37:29 +0000 2018,https://t.co/E3xvdUGZqa
Sat Jul 28 01:53:48 +0000 2018,"Join me in Tampa, Florida next Tuesday, July 31st at 7:00pmE for a #MAGA Rally! Tickets: https://t.co/Q2PMyTACl8 https://t.co/URjvN8Owoe"
Sat Jul 28 00:47:58 +0000 2018,"The only things the Democrats do well is “Resist,” which is their campaign slogan, and “Obstruct.” Cryin’ Chuck Sch… https://t.co/GBFgVFHKgz"
Fri Jul 27 22:45:56 +0000 2018,"Democrats, who want Open Borders and care little about Crime, are incompetent, but they have the Fake News Media al… https://t.co/x2QxE3DYGu"
Fri Jul 27 20:08:06 +0000 2018,Congressman David Kustoff has been a champion for the Trump Agenda - I greatly appreciate his support. David is str… https://t.co/b69nex9NfW
Fri Jul 27 19:23:07 +0000 2018,Private business investment has surged from 1.8 percent the year BEFORE I came into office to 9.4 percent this year… https://t.co/LSqCNJs3u8
Fri Jul 27 18:16:46 +0000 2018,"The @USNavy’s first female Admiral, Alene Duerk once said: “It was a nice distinction to have, and to be recognized… https://t.co/PWflPU2xFK"
Fri Jul 27 16:20:37 +0000 2018,We have accomplished an economic turnaround of HISTORIC proportions! https://t.co/vnmMtPv0kk
Fri Jul 27 16:12:14 +0000 2018,"I am thrilled to announce that in the second quarter of this year, the U.S. Economy grew at the amazing rate of 4.1… https://t.co/cLRtLfjBnU"
Fri Jul 27 15:58:45 +0000 2018,.@Troy_Balderson of Ohio is running for Congress - so important to the Republican Party. Cast you early vote or vot… https://t.co/sydEr50eNt
Fri Jul 27 15:53:20 +0000 2018,"...John is strong on crime and borders, loves our Military, our Vets and our Second Amendment. He will be a star. H… https://t.co/cqM3RjxNdF"
Fri Jul 27 15:53:20 +0000 2018,".@JohnJamesMI, who is running in the Republican Primary in the great state of Michigan, is SPECTACULAR! Vote on Aug… https://t.co/CNHue2l4v2"
Fri Jul 27 13:17:09 +0000 2018,GREAT GDP numbers just released. Will be having a news conference soon!
Fri Jul 27 11:56:15 +0000 2018,".....I did NOT know of the meeting with my son, Don jr. Sounds to me like someone is trying to make up stories in o… https://t.co/NyveRg8BqR"
Fri Jul 27 11:38:32 +0000 2018,"....,the only Collusion with Russia was with the Democrats, so now they are looking at my Tweets (along with 53 mil… https://t.co/fCI5RcdZK5"
Fri Jul 27 11:26:20 +0000 2018,"Arrived back in Washington last night from a very emotional reopening of a major U.S. Steel plant in Granite City,… https://t.co/WJxWOlaRbb"
Fri Jul 27 10:56:17 +0000 2018,Way to go Jerry. This is what the league should do! https://t.co/yEP1jK57xi
Fri Jul 27 03:50:54 +0000 2018,The Remains of American Servicemen will soon be leaving North Korea and heading to the United States! After so many… https://t.co/Z1eLJv6bES
Fri Jul 27 02:37:00 +0000 2018,America is OPEN FOR BUSINESS and U.S. Steel is back! https://t.co/lJTcr6JHBW
Thu Jul 26 22:48:40 +0000 2018,"...called “The Case Against Impeaching Trump,” which I would encourage all people with Trump Derangement Syndrome to read!"
Thu Jul 26 22:48:38 +0000 2018,".@AlanDersh, a brilliant lawyer, who although a Liberal Democrat who probably didn’t vote for me, has discussed the… https://t.co/TOjjyGMIlf"
Thu Jul 26 21:43:13 +0000 2018,PROMISES KEPT! https://t.co/vR2R5WXPVD
Thu Jul 26 21:12:45 +0000 2018,"Thank you @U_S_Steel and Granite City, Illinois! https://t.co/6RsUvGF6rg"
Thu Jul 26 15:22:39 +0000 2018,"The United States will impose large sanctions on Turkey for their long time detainment of Pastor Andrew Brunson, a… https://t.co/PnHVJEY6uO"
Thu Jul 26 14:52:18 +0000 2018,"This is great - on my way, see you soon @IAGovernor Kim Reynolds! https://t.co/SXfkk12Uig"
Thu Jul 26 14:11:30 +0000 2018,"Heading to Dubuque, Iowa and then Granite City, Illinois. Looking  forward to being with many great friends!"
Thu Jul 26 11:46:09 +0000 2018,Twitter “SHADOW BANNING” prominent Republicans. Not good. We will look into this discriminatory and illegal practic… https://t.co/Ml5infKJ0B
Thu Jul 26 01:07:28 +0000 2018,European Union representatives told me that they would start buying soybeans from our great farmers immediately. Al… https://t.co/Yuqt4KNeDz
Thu Jul 26 01:01:08 +0000 2018,Great to be back on track with the European Union. This was a big day for free and fair trade!
Thu Jul 26 00:57:19 +0000 2018,"RT @Scavino45: “We met today...to launch a new phase in the relationship between the U.S. &amp; the EU – a phase of close friendship, of strong…"
Thu Jul 26 00:16:32 +0000 2018,"Thank you Georgia! They say that my endorsement last week of Brian Kemp, in the Republican Primary for Governor aga… https://t.co/M1mCXcWQup"
Wed Jul 25 23:49:34 +0000 2018,"Obviously the European Union, as represented by @JunckerEU and the United States, as represented by yours truly, lo… https://t.co/lCQ2nShUeM"
Wed Jul 25 23:42:24 +0000 2018,...along quickly. European Union Nations will be open to the United States and at the same time benefiting by every… https://t.co/fvNuvtAfE9
Wed Jul 25 23:42:23 +0000 2018,Great meeting on Trade today with @JunckerEU and representatives of the European Union. We have come to a very stro… https://t.co/cOa4atnFMC
Wed Jul 25 22:59:35 +0000 2018,"Thank you very much, working hard! https://t.co/cSzbFfq2NW"
Wed Jul 25 22:45:49 +0000 2018,"Sergio Marchionne, who passed away today, was one of the most brilliant &amp; successful car executives since the days… https://t.co/h3QOAyG4fP"
Wed Jul 25 22:33:01 +0000 2018,"This week, my Administration is hosting the first-ever #IRFMinisterial. The U.S. will continue to promote… https://t.co/nD019chBeX"
Wed Jul 25 20:57:24 +0000 2018,The United States and the European Union have a $1 TRILLION bilateral trade relationship – the largest economic rel… https://t.co/tZ5hQIITht
Wed Jul 25 12:41:14 +0000 2018,"Congratulations to Brian Kemp on your very big win in Georgia last night. Wow, 69-30, those are big numbers. Now go… https://t.co/aKmZW1hezY"
Wed Jul 25 12:34:58 +0000 2018,"What kind of a lawyer would tape a client? So sad! Is this a first, never heard of it before? Why was the tape so a… https://t.co/ypyRQGeh2N"
Wed Jul 25 11:20:28 +0000 2018,"China is targeting our farmers, who they know I love &amp; respect, as a way of getting me to continue allowing them to… https://t.co/19hwB4J1P6"
Wed Jul 25 11:08:39 +0000 2018,"When you have people snipping at your heels during a negotiation, it will only take longer to make a deal, and the… https://t.co/Z7jZQUbNin"
Wed Jul 25 11:01:05 +0000 2018,"Every time I see a weak politician asking to stop Trade talks or the use of Tariffs to counter unfair Tariffs, I wo… https://t.co/w8JtdCHlj8"
Wed Jul 25 01:05:05 +0000 2018,"“The Russia Hoax, The Illicit Scheme To Clear Hillary Clinton &amp; Frame Donald Trump” is a Hot Seller, already Number… https://t.co/KAHE9AiBFg"
Wed Jul 25 00:39:16 +0000 2018,So sad and unfair that the FCC wouldn’t approve the Sinclair Broadcast merger with Tribune. This would have been a… https://t.co/8LKvxxuRrY
Wed Jul 25 00:08:01 +0000 2018,The European Union is coming to Washington tomorrow to negotiate a deal on Trade. I have an idea for them. Both the… https://t.co/0gVggyvjon
Tue Jul 24 22:33:30 +0000 2018,"Today, it was my great honor to be in Kansas City, Missouri to pay tribute to the men and women who make FREEDOM po… https://t.co/Ozz3wtLlPK"
Tue Jul 24 22:25:07 +0000 2018,"On the heels of the VERY successful launch of the @WhiteHouse National Council for the American Worker, Congress sh… https://t.co/QITR8JUFY7"
Tue Jul 24 19:15:36 +0000 2018,"I want to thank the @VFWHQ for your devotion to our fallen heroes, unknown soldiers, Prisoners of War, those Missin… https://t.co/p5PLlxRJN9"
Tue Jul 24 17:51:28 +0000 2018,#VFWConvention @VFWHQ https://t.co/dBQx526axz
Tue Jul 24 15:50:37 +0000 2018,I’m very concerned that Russia will be fighting very hard to have an impact on the upcoming Election. Based on the… https://t.co/mQz28UCOkh
Tue Jul 24 13:54:19 +0000 2018,MAKE AMERICA GREAT AGAIN!
Tue Jul 24 13:52:56 +0000 2018,Heading to Missouri to be with many of my great friends. VFW here we come!
Tue Jul 24 13:46:22 +0000 2018,Our Country is doing GREAT. Best financial numbers on the Planet. Great to have USA WINNING AGAIN!
Tue Jul 24 13:39:49 +0000 2018,"Today is the day to vote for Brian Kemp. Will be great for Georgia, full Endorsement! https://t.co/yPND2bJ219"
Tue Jul 24 11:29:50 +0000 2018,Tariffs are the greatest! Either a country which has treated the United States unfairly on Trade negotiates a fair… https://t.co/iYLwdq5W9g
Tue Jul 24 11:09:12 +0000 2018,Countries that have treated us unfairly on trade for years are all coming to Washington to negotiate. This should h… https://t.co/FIhM2DI5Gl
Tue Jul 24 11:01:27 +0000 2018,RT @DanScavino: “Coast Guard seizes $729M worth of cocaine from boats moving drugs from Central America to the US” https://t.co/R7fFD5BJTb
Tue Jul 24 11:01:13 +0000 2018,"RT @DanScavino: “Lockheed Martin will add 400 workers to boost production of the F-35 fighter jet, the most expensive in U.S. history, afte…"
Tue Jul 24 02:07:39 +0000 2018,#MadeInAmerica Showcase! https://t.co/rT0WIE99yP
Tue Jul 24 01:44:06 +0000 2018,Lou Barletta was one of my first supporters. He is tough on Crime and Borders. Will be a great Senator from Pennsyl… https://t.co/DJ58XBq7Dl
Tue Jul 24 01:35:37 +0000 2018,Robert will do a great job for our Vets. We also recently won Choice! https://t.co/hE0GDuCBET
Mon Jul 23 13:35:20 +0000 2018,....In my opinion the Washington Post is nothing more than an expensive (the paper loses a fortune) lobbyist for Am… https://t.co/wWibi4UQ2F
Mon Jul 23 13:21:15 +0000 2018,The Amazon Washington Post has gone crazy against me ever since they lost the Internet Tax Case in the U.S. Supreme… https://t.co/OUL6J4UdEo
Mon Jul 23 13:06:18 +0000 2018,"A Rocket has not been launched by North Korea in 9 months. Likewise, no Nuclear Tests. Japan is happy, all of Asia… https://t.co/g3B65VpB08"
Mon Jul 23 12:25:02 +0000 2018,"When you hear the Fake News talking negatively about my meeting with President Putin, and all that I gave up, remem… https://t.co/OUhqQtlDAg"
Mon Jul 23 11:09:39 +0000 2018,".....”Carter Page wasn’t a spy, wasn’t an agent of the Russians - he would have cooperated with the FBI. It was a f… https://t.co/7Yo9u8T93f"
Mon Jul 23 11:01:15 +0000 2018,"....and the DOJ, FBI and Obama Gang need to be held to account. Source #1 was the major source. Avoided talking abo… https://t.co/3oCymGEBOa"
Mon Jul 23 10:52:10 +0000 2018,“It was classified to cover up misconduct by the FBI and the Justice Department in misleading the Court by using th… https://t.co/BzCDQSgbjD
Mon Jul 23 10:30:11 +0000 2018,"So we now find out that it was indeed the unverified and Fake Dirty Dossier, that was paid for by Crooked Hillary C… https://t.co/27dWDeEvBK"
Mon Jul 23 10:13:52 +0000 2018,Tom Fitton on @foxandfriends at 6:15 A.M. NOW! Judicial Watch.
Mon Jul 23 03:24:19 +0000 2018,"To Iranian President Rouhani: NEVER, EVER THREATEN THE UNITED STATES AGAIN OR YOU WILL SUFFER CONSEQUENCES THE LIKE… https://t.co/xUdD66vfBW"
Sun Jul 22 22:23:52 +0000 2018,So President Obama knew about Russia before the Election. Why didn’t he do something about it? Why didn’t he tell o… https://t.co/nea8iLbSRe
Sun Jul 22 20:58:44 +0000 2018,Happy Birthday @SenatorDole! https://t.co/MiVoB7qC6A
Sun Jul 22 13:15:18 +0000 2018,I had a GREAT meeting with Putin and the Fake News used every bit of their energy to try and disparage it. So bad for our country!
Sun Jul 22 12:56:15 +0000 2018,".@PeteHegseth on @FoxNews  “Source #1 was the (Fake) Dossier. Yes, the Dirty Dossier, paid for by Democrats as a hi… https://t.co/cts37TsoLn"
Sun Jul 22 12:22:49 +0000 2018,Andrew McCarthy - “I said this could never happen. This is so bad that they should be looking at the judges who sig… https://t.co/U4BO2BFPph
Sun Jul 22 10:49:25 +0000 2018,Looking more &amp; more like the Trump Campaign for President was illegally being spied upon (surveillance) for the pol… https://t.co/36aqUFnEI9
Sun Jul 22 10:28:40 +0000 2018,Congratulations to @JudicialWatch and @TomFitton on being successful in getting the Carter Page FISA documents. As… https://t.co/Ra2PCplr4S
